{
  "bls_code": "Y332132",
  "source_group": "Y",
  "name_de": "Schweineschnitzel paniert, gebraten",
  "name_en": "Pork schnitzel breaded, fried",
  "note": null,
  "nutrients": {
    "ENERCJ": {
      "value": 919,
      "data_origin": "Formelberechnung",
      "reference": "-"
    },
    "ENERCC": {
      "value": 220,
      "data_origin": "Formelberechnung",
      "reference": "-"
    },
    "WATER": {
      "value": 56.4,
      "data_origin": "Rezeptberechnung",
      "reference": "-"
    },
    "PROT625": {
      "value": 22.65,
      "data_origin": "Rezeptberechnung",
      "reference": "-"
    },
    "FAT": {
      "value": 10.6,
      "data_origin": "Rezeptberechnung",
      "reference": "-"
    },
    "CHO": {
      "value": 7.59,
      "data_origin": "Formelberechnung",
      "reference": "-"
    },
    "FIBT": {
      "value": 0.69,
      "data_origin": "Rezeptberechnung",
      "reference": "-"
    },
    "ALC": {
      "value": 0.002,
      "data_origin": "Rezeptberechnung",
      "reference": "-"
    },
    "OA": {
      "value": 0.58,
      "data_origin": "Rezeptberechnung",
      "reference": "-"
    },
    "ASH": {
      "value": 1.52,
      "data_origin": "Rezeptberechnung",
      "reference": "-"
    },
    "VITA": {
      "value": 23,
      "data_origin": "Formelberechnung",
      "reference": "-"
    },
    "VITAA": {
      "value": 22,
      "data_origin": "Formelberechnung",
      "reference": "-"
    },
    "RETOL": {
      "value": 21.8,
      "data_origin": "Rezeptberechnung",
      "reference": "-"
    },
    "CARTB": {
      "value": 7,
      "data_origin": "Rezeptberechnung",
      "reference": "-"
    },
    "CAROTPAXB": {
      "value": 2,
      "data_origin": "Rezeptberechnung",
      "reference": "-"
    },
    "VITD": {
      "value": 0.2,
      "data_origin": "Formelberechnung",
      "reference": "-"
    },
    "CHOCAL": {
      "value": 0.2,
      "data_origin": "Rezeptberechnung",
      "reference": "-"
    },
    "ERGCAL": {
      "value": 0,
      "data_origin": "Rezeptberechnung",
      "reference": "-"
    },
    "VITE": {
      "value": 0.955,
      "data_origin": "Rezeptberechnung",
      "reference": "-"
    },
    "TOCPHA": {
      "value": 0.955,
      "data_origin": "Rezeptberechnung",
      "reference": "-"
    },
    "TOCPHB": {
      "value": 0.03,
      "data_origin": "Rezeptberechnung",
      "reference": "-"
    },
    "TOCPHG": {
      "value": 0.66,
      "data_origin": "Rezeptberechnung",
      "reference": "-"
    },
    "TOCPHD": {
      "value": 0,
      "data_origin": "Rezeptberechnung",
      "reference": "-"
    },
    "TOCTRA": {
      "value": 0.004,
      "data_origin": "Rezeptberechnung",
      "reference": "-"
    },
    "VITK": {
      "value": 13,
      "data_origin": "Formelberechnung",
      "reference": "-"
    },
    "VITK1": {
      "value": 9,
      "data_origin": "Rezeptberechnung",
      "reference": "-"
    },
    "VITK2": {
      "value": 4,
      "data_origin": "Rezeptberechnung",
      "reference": "-"
    },
    "THIA": {
      "value": 0.62,
      "data_origin": "Rezeptberechnung",
      "reference": "-"
    },
    "RIBF": {
      "value": 0.222,
      "data_origin": "Rezeptberechnung",
      "reference": "-"
    },
    "NIAEQ": {
      "value": 8.81,
      "data_origin": "Formelberechnung",
      "reference": "-"
    },
    "NIA": {
      "value": 3.74,
      "data_origin": "Rezeptberechnung",
      "reference": "-"
    },
    "PANTAC": {
      "value": 0.71,
      "data_origin": "Rezeptberechnung",
      "reference": "-"
    },
    "VITB6": {
      "value": 311,
      "data_origin": "Rezeptberechnung",
      "reference": "-"
    },
    "BIOT": {
      "value": 6,
      "data_origin": "Rezeptberechnung",
      "reference": "-"
    },
    "FOL": {
      "value": 14,
      "data_origin": "Formelberechnung",
      "reference": "-"
    },
    "FOLFD": {
      "value": 14,
      "data_origin": "Rezeptberechnung",
      "reference": "-"
    },
    "FOLAC": {
      "value": 0,
      "data_origin": "Rezeptberechnung",
      "reference": "-"
    },
    "VITB12": {
      "value": 1.1,
      "data_origin": "Rezeptberechnung",
      "reference": "-"
    },
    "VITC": {
      "value": 4.738,
      "data_origin": "Rezeptberechnung",
      "reference": "-"
    },
    "NACL": {
      "value": 0.53,
      "data_origin": "Formelberechnung",
      "reference": "-"
    },
    "NA": {
      "value": 212,
      "data_origin": "Rezeptberechnung",
      "reference": "-"
    },
    "CLD": {
      "value": 230,
      "data_origin": "Rezeptberechnung",
      "reference": "-"
    },
    "K": {
      "value": 295,
      "data_origin": "Rezeptberechnung",
      "reference": "-"
    },
    "CA": {
      "value": 19,
      "data_origin": "Rezeptberechnung",
      "reference": "-"
    },
    "MG": {
      "value": 24,
      "data_origin": "Rezeptberechnung",
      "reference": "-"
    },
    "P": {
      "value": 183,
      "data_origin": "Rezeptberechnung",
      "reference": "-"
    },
    "S": {
      "value": 12,
      "data_origin": "Rezeptberechnung",
      "reference": "-"
    },
    "FE": {
      "value": 1.8,
      "data_origin": "Rezeptberechnung",
      "reference": "-"
    },
    "ZN": {
      "value": 2.63,
      "data_origin": "Rezeptberechnung",
      "reference": "-"
    },
    "ID": {
      "value": 5,
      "data_origin": "Rezeptberechnung",
      "reference": "-"
    },
    "CU": {
      "value": 90,
      "data_origin": "Rezeptberechnung",
      "reference": "-"
    },
    "MN": {
      "value": 110,
      "data_origin": "Rezeptberechnung",
      "reference": "-"
    },
    "FD": {
      "value": 100,
      "data_origin": "Rezeptberechnung",
      "reference": "-"
    },
    "CR": {
      "value": 0,
      "data_origin": "Rezeptberechnung",
      "reference": "-"
    },
    "MO": {
      "value": 1.6,
      "data_origin": "Rezeptberechnung",
      "reference": "-"
    },
    "ACEAC": {
      "value": 0.004,
      "data_origin": "Rezeptberechnung",
      "reference": "-"
    },
    "CITAC": {
      "value": 0.4,
      "data_origin": "Rezeptberechnung",
      "reference": "-"
    },
    "LACAC": {
      "value": 0.009,
      "data_origin": "Rezeptberechnung",
      "reference": "-"
    },
    "MALAC": {
      "value": 0.025,
      "data_origin": "Rezeptberechnung",
      "reference": "-"
    },
    "TARAC": {
      "value": 0,
      "data_origin": "Rezeptberechnung",
      "reference": "-"
    },
    "POLYL": {
      "value": 0.001,
      "data_origin": "Formelberechnung",
      "reference": "-"
    },
    "MANTL": {
      "value": 0,
      "data_origin": "Rezeptberechnung",
      "reference": "-"
    },
    "SORTL": {
      "value": 0.001,
      "data_origin": "Rezeptberechnung",
      "reference": "-"
    },
    "XYLTL": {
      "value": 0,
      "data_origin": "Rezeptberechnung",
      "reference": "-"
    },
    "MNSAC": {
      "value": 0.37,
      "data_origin": "Formelberechnung",
      "reference": "-"
    },
    "GLUS": {
      "value": 0.19,
      "data_origin": "Rezeptberechnung",
      "reference": "-"
    },
    "FRUS": {
      "value": 0.18,
      "data_origin": "Rezeptberechnung",
      "reference": "-"
    },
    "GALS": {
      "value": 0,
      "data_origin": "Rezeptberechnung",
      "reference": "-"
    },
    "DISAC": {
      "value": 0.35,
      "data_origin": "Formelberechnung",
      "reference": "-"
    },
    "SUCS": {
      "value": 0.041,
      "data_origin": "Rezeptberechnung",
      "reference": "-"
    },
    "MALS": {
      "value": 0.31,
      "data_origin": "Rezeptberechnung",
      "reference": "-"
    },
    "LACS": {
      "value": 0,
      "data_origin": "Rezeptberechnung",
      "reference": "-"
    },
    "SUGAR": {
      "value": 0.72,
      "data_origin": "Formelberechnung",
      "reference": "-"
    },
    "OLSAC": {
      "value": "-",
      "data_origin": "-",
      "reference": "-"
    },
    "STARCH": {
      "value": 6.87,
      "data_origin": "Rezeptberechnung",
      "reference": "-"
    },
    "FIBLMW": {
      "value": "-",
      "data_origin": "-",
      "reference": "-"
    },
    "FIBHMW": {
      "value": "-",
      "data_origin": "-",
      "reference": "-"
    },
    "FIBINS": {
      "value": "-",
      "data_origin": "-",
      "reference": "-"
    },
    "FIBSOL": {
      "value": "-",
      "data_origin": "-",
      "reference": "-"
    },
    "FIBHMWS": {
      "value": "-",
      "data_origin": "-",
      "reference": "-"
    },
    "FIBHMWI": {
      "value": "-",
      "data_origin": "-",
      "reference": "-"
    },
    "FASAT": {
      "value": 1.53,
      "data_origin": "Formelberechnung",
      "reference": "-"
    },
    "F4:0": {
      "value": 0,
      "data_origin": "Rezeptberechnung",
      "reference": "-"
    },
    "F6:0": {
      "value": 0,
      "data_origin": "Rezeptberechnung",
      "reference": "-"
    },
    "F8:0": {
      "value": 0,
      "data_origin": "Rezeptberechnung",
      "reference": "-"
    },
    "F10:0": {
      "value": 0,
      "data_origin": "Rezeptberechnung",
      "reference": "-"
    },
    "F12:0": {
      "value": 0,
      "data_origin": "Rezeptberechnung",
      "reference": "-"
    },
    "F14:0": {
      "value": 0.04,
      "data_origin": "Rezeptberechnung",
      "reference": "-"
    },
    "F15:0": {
      "value": 0.001,
      "data_origin": "Rezeptberechnung",
      "reference": "-"
    },
    "F16:0": {
      "value": 0.99,
      "data_origin": "Rezeptberechnung",
      "reference": "-"
    },
    "F17:0": {
      "value": 0.01,
      "data_origin": "Rezeptberechnung",
      "reference": "-"
    },
    "F18:0": {
      "value": 0.4,
      "data_origin": "Rezeptberechnung",
      "reference": "-"
    },
    "F20:0": {
      "value": 0.05,
      "data_origin": "Rezeptberechnung",
      "reference": "-"
    },
    "F22:0": {
      "value": 0.03,
      "data_origin": "Rezeptberechnung",
      "reference": "-"
    },